{
  "event_id": "7a8b9c0d-1e2f-3456-abcd-e78901234567",
  "event_type": "PROMPT_VERSION_APPROVED",
  "event_category": "prompt-lifecycle",
  "event_time": "2025-01-30T11:00:00.000Z",
  "agent_id": "agent.governance-admin",
  "agent_name": "Governance Admin",
  "org_id": "org.brightpath-edu",
  "org_name": "BrightPath Education",
  "policy_id": "",
  "policy_name": "",
  "policy_version": 0,
  "prompt_id": "prm-055",
  "prompt_name": "prompt.student-advising-guidelines",
  "prompt_version": 2,
  "governance_hash": "f8a9b0c1d2e3f4a5b6c7d8e9f0a1b2c3d4e5f6a7b8c9d0e1f2a3b4c5d6e7f8a9",
  "hash_type": "sha256",
  "trace_id": "c90de123-f456-78ab-cd90-ef12ab345678",
  "data_classification": "internal",
  "template_rendered": false,
  "denial_reason": "",
  "violation_type": "",
  "severity": "",
  "source_ip": "192.168.5.10",
  "request_method": "POST",
  "request_path": "/api/prompts/prm-055/versions/pver-002/approve",
  "ingested_at": "2025-01-30T11:00:00.890Z",
  "annotations": {
    "approved_by": "provost-office@brightpath-edu.com",
    "review_duration_hours": 42,
    "linked_agents": [
      "agent.student-advisor",
      "agent.enrollment-assistant"
    ],
    "regulatory_hooks": [
      "FERPA"
    ]
  }
}
